### ISSUE TITLE
Postfix takes a long time to reply to RCPT TO

### ISSUE THREAD

**Issue by UbiquitousBear** [Mailu/Mailu#1506]
Postfix appears to be taking a long time to respond to RCPT TO commands, which causes mail to be delayed.

Sometimes the connection times out or 'Internal Server Error' is returned. 

```
220 <redacted> ESMTP ready
EHLO mx.vm.net
250-<redacted>
250-PIPELINING
250-SIZE
250-52428800
250-ETRN
250-ENHANCEDSTATUSCODES
250-8BITMIME
250-DSN
250-CHUNKING
250 STARTTLS
MAIL FROM: shamil@vm.net
250 2.0.0 OK
RCPT TO: <redacted>
451 4.3.2 Internal server error
Connection closed by foreign host.
```

I ran tcpdump against the postfix container:

Logs from smtp/postfix:

```
May 15 14:12:56 mail postfix/smtpd[20904]: connect from 192-168-152-4.mailserver-front.mailserver.svc.cluster.local[192.168.152.4]
May 15 14:12:56 mail postfix/smtpd[20904]: lost connection after CONNECT from 192-168-152-4.mailserver-front.mailserver.svc.cluster.local[192.168.152.4]
May 15 14:12:56 mail postfix/smtpd[20904]: disconnect from 192-168-152-4.mailserver-front.mailserver.svc.cluster.local[192.168.152.4] commands=0/0
```

The connection is lost after RCPT TO is sent.

tcpdump:
```
bash-5.0# tcpdump
tcpdump: verbose output suppressed, use -v or -vv for full protocol decode
listening on eth0, link-type EN10MB (Ethernet), capture size 262144 bytes
14:08:53.448109 IP 192-168-152-4.mailserver-front.mailserver.svc.cluster.local.33700 > mailserver-postfix-7cc47f5458-wj5js.25: Flags [S], seq 3427307910, win 28000, options [mss 1400,sackOK,TS val 175731957 ecr 0,nop,wscale 7], length 0
14:08:53.448125 IP mailserver-postfix-7cc47f5458-wj5js.25 > 192-168-152-4.mailserver-front.mailserver.svc.cluster.local.33700: Flags [S.], seq 1604122734, ack 3427307911, win 27760, options [mss 1400,sackOK,TS val 175731957 ecr 175731957,nop,wscale 7], length 0
14:08:53.448142 IP 192-168-152-4.mailserver-front.mailserver.svc.cluster.local.33700 > mailserver-postfix-7cc47f5458-wj5js.25: Flags [.], ack 1, win 219, options [nop,nop,TS val 175731957 ecr 175731957], length 0
14:08:53.448220 IP mailserver-postfix-7cc47f5458-wj5js.40478 > kube-dns.kube-system.svc.cluster.local.53: 64814+ PTR? 4.152.168.192.in-addr.arpa. (44)
14:08:53.448367 IP kube-dns.kube-system.svc.cluster.local.53 > mailserver-postfix-7cc47f5458-wj5js.40478: 64814*- 1/0/0 PTR 192-168-152-4.mailserver-front.mailserver.svc.cluster.local. (143)
14:08:53.448407 IP mailserver-postfix-7cc47f5458-wj5js.34244 > kube-dns.kube-system.svc.cluster.local.53: 3740+ PTR? 4.152.168.192.in-addr.arpa. (44)
14:08:53.448542 IP kube-dns.kube-system.svc.cluster.local.53 > mailserver-postfix-7cc47f5458-wj5js.34244: 3740*- 1/0/0 PTR 192-168-152-4.mailserver-front.mailserver.svc.cluster.local. (143)
14:08:53.448641 IP mailserver-postfix-7cc47f5458-wj5js.58958 > kube-dns.kube-system.svc.cluster.local.53: 41615+ PTR? 10.0.96.10.in-addr.arpa. (41)
14:08:53.448747 IP kube-dns.kube-system.svc.cluster.local.53 > mailserver-postfix-7cc47f5458-wj5js.58958: 41615*- 1/0/0 PTR kube-dns.kube-system.svc.cluster.local. (116)




14:08:55.539992 ARP, Request who-has mailserver-postfix-7cc47f5458-wj5js tell ingress-nginx-controller.ingress-nginx.svc.cluster.local, length 28
14:08:55.540033 ARP, Reply mailserver-postfix-7cc47f5458-wj5js is-at c2:b8:e1:bb:31:31 (oui Unknown), length 28
14:08:55.540135 IP mailserver-postfix-7cc47f5458-wj5js.57862 > kube-dns.kube-system.svc.cluster.local.53: 31076+ PTR? 119.118.77.51.in-addr.arpa. (44)
14:08:55.540355 IP kube-dns.kube-system.svc.cluster.local.53 > mailserver-postfix-7cc47f5458-wj5js.57862: 31076*- 1/0/0 PTR ingress-nginx-controller.ingress-nginx.svc.cluster.local. (140)




14:09:21.152323 IP mailserver-postfix-7cc47f5458-wj5js.41557 > kube-dns.kube-system.svc.cluster.local.53: 61094+ A? mailserver-rspamd.mailserver.svc.cluster.local. (64)
14:09:21.152391 IP mailserver-postfix-7cc47f5458-wj5js.41557 > kube-dns.kube-system.svc.cluster.local.53: 61398+ AAAA? mailserver-rspamd.mailserver.svc.cluster.local. (64)
14:09:21.152603 IP kube-dns.kube-system.svc.cluster.local.53 > mailserver-postfix-7cc47f5458-wj5js.41557: 61398*- 0/1/0 (157)
14:09:21.152646 IP kube-dns.kube-system.svc.cluster.local.53 > mailserver-postfix-7cc47f5458-wj5js.41557: 61094*- 1/0/0 A 10.110.75.220 (126)
14:09:21.152682 IP mailserver-postfix-7cc47f5458-wj5js.46490 > mailserver-rspamd.mailserver.svc.cluster.local.11332: Flags [S], seq 4008078250, win 28000, options [mss 1400,sackOK,TS val 175738883 ecr 0,nop,wscale 7], length 0
14:09:21.152737 IP mailserver-rspamd.mailserver.svc.cluster.local.11332 > mailserver-postfix-7cc47f5458-wj5js.46490: Flags [S.], seq 98035333, ack 4008078251, win 27760, options [mss 1400,sackOK,TS val 175738883 ecr 175738883,nop,wscale 7], length 0
14:09:21.152747 IP mailserver-postfix-7cc47f5458-wj5js.46490 > mailserver-rspamd.mailserver.svc.cluster.local.11332: Flags [.], ack 1, win 219, options [nop,nop,TS val 175738883 ecr 175738883], length 0
14:09:21.152753 IP mailserver-postfix-7cc47f5458-wj5js.49219 > kube-dns.kube-system.svc.cluster.local.53: 25551+ PTR? 220.75.110.10.in-addr.arpa. (44)
14:09:21.152781 IP mailserver-postfix-7cc47f5458-wj5js.46490 > mailserver-rspamd.mailserver.svc.cluster.local.11332: Flags [P.], seq 1:18, ack 1, win 219, options [nop,nop,TS val 175738883 ecr 175738883], length 17
14:09:21.152791 IP mailserver-rspamd.mailserver.svc.cluster.local.11332 > mailserver-postfix-7cc47f5458-wj5js.46490: Flags [.], ack 18, win 217, options [nop,nop,TS val 175738883 ecr 175738883], length 0
14:09:21.152871 IP mailserver-rspamd.mailserver.svc.cluster.local.11332 > mailserver-postfix-7cc47f5458-wj5js.46490: Flags [P.], seq 1:18, ack 18, win 217, options [nop,nop,TS val 175738883 ecr 175738883], length 17
14:09:21.152879 IP mailserver-postfix-7cc47f5458-wj5js.46490 > mailserver-rspamd.mailserver.svc.cluster.local.11332: Flags [.], ack 18, win 219, options [nop,nop,TS val 175738883 ecr 175738883], length 0
14:09:21.152914 IP kube-dns.kube-system.svc.cluster.local.53 > mailserver-postfix-7cc47f5458-wj5js.49219: 25551*- 1/0/0 PTR mailserver-rspamd.mailserver.svc.cluster.local. (130)
14:09:21.152932 IP mailserver-postfix-7cc47f5458-wj5js.46490 > mailserver-rspamd.mailserver.svc.cluster.local.11332: Flags [P.], seq 18:143, ack 18, win 219, options [nop,nop,TS val 175738883 ecr 175738883], length 125
14:09:21.152944 IP mailserver-postfix-7cc47f5458-wj5js.46490 > mailserver-rspamd.mailserver.svc.cluster.local.11332: Flags [F.], seq 143, ack 18, win 219, options [nop,nop,TS val 175738883 ecr 175738883], length 0
14:09:21.152988 IP mailserver-rspamd.mailserver.svc.cluster.local.11332 > mailserver-postfix-7cc47f5458-wj5js.46490: Flags [F.], seq 18, ack 144, win 217, options [nop,nop,TS val 175738883 ecr 175738883], length 0
14:09:21.152995 IP mailserver-postfix-7cc47f5458-wj5js.46490 > mailserver-rspamd.mailserver.svc.cluster.local.11332: Flags [.], ack 19, win 219, options [nop,nop,TS val 175738883 ecr 175738883], length 0



14:09:46.818754 IP 192-168-152-4.mailserver-front.mailserver.svc.cluster.local.35378 > mailserver-postfix-7cc47f5458-wj5js.25: Flags [S], seq 1578558100, win 28000, options [mss 1400,sackOK,TS val 175745299 ecr 0,nop,wscale 7], length 0
14:09:46.818778 IP mailserver-postfix-7cc47f5458-wj5js.25 > 192-168-152-4.mailserver-front.mailserver.svc.cluster.local.35378: Flags [S.], seq 2953198658, ack 1578558101, win 27760, options [mss 1400,sackOK,TS val 175745299 ecr 175745299,nop,wscale 7], length 0
14:09:46.818798 IP 192-168-152-4.mailserver-front.mailserver.svc.cluster.local.35378 > mailserver-postfix-7cc47f5458-wj5js.25: Flags [.], ack 1, win 219, options [nop,nop,TS val 175745299 ecr 175745299], length 0

14:09:51.859961 ARP, Request who-has mailserver-postfix-7cc47f5458-wj5js tell ingress-nginx-controller.ingress-nginx.svc.cluster.local, length 28
14:09:51.860008 ARP, Reply mailserver-postfix-7cc47f5458-wj5js is-at c2:b8:e1:bb:31:31 (oui Unknown), length 28
14:09:51.872362 IP mailserver-postfix-7cc47f5458-wj5js.47188 > kube-dns.kube-system.svc.cluster.local.53: 985+ A? mailserver-rspamd.mailserver.svc.cluster.local. (64)
14:09:51.872427 IP mailserver-postfix-7cc47f5458-wj5js.47188 > kube-dns.kube-system.svc.cluster.local.53: 1211+ AAAA? mailserver-rspamd.mailserver.svc.cluster.local. (64)
14:09:51.872655 IP kube-dns.kube-system.svc.cluster.local.53 > mailserver-postfix-7cc47f5458-wj5js.47188: 1211*- 0/1/0 (157)
14:09:51.872705 IP kube-dns.kube-system.svc.cluster.local.53 > mailserver-postfix-7cc47f5458-wj5js.47188: 985*- 1/0/0 A 10.110.75.220 (126)
14:09:51.872759 IP mailserver-postfix-7cc47f5458-wj5js.47420 > mailserver-rspamd.mailserver.svc.cluster.local.11332: Flags [S], seq 2342448319, win 28000, options [mss 1400,sackOK,TS val 175746563 ecr 0,nop,wscale 7], length 0
14:09:51.872825 IP mailserver-rspamd.mailserver.svc.cluster.local.11332 > mailserver-postfix-7cc47f5458-wj5js.47420: Flags [S.], seq 754468769, ack 2342448320, win 27760, options [mss 1400,sackOK,TS val 175746563 ecr 175746563,nop,wscale 7], length 0
14:09:51.872840 IP mailserver-postfix-7cc47f5458-wj5js.47420 > mailserver-rspamd.mailserver.svc.cluster.local.11332: Flags [.], ack 1, win 219, options [nop,nop,TS val 175746563 ecr 175746563], length 0
14:09:51.872876 IP mailserver-postfix-7cc47f5458-wj5js.47420 > mailserver-rspamd.mailserver.svc.cluster.local.11332: Flags [P.], seq 1:18, ack 1, win 219, options [nop,nop,TS val 175746563 ecr 175746563], length 17
14:09:51.872889 IP mailserver-rspamd.mailserver.svc.cluster.local.11332 > mailserver-postfix-7cc47f5458-wj5js.47420: Flags [.], ack 18, win 217, options [nop,nop,TS val 175746563 ecr 175746563], length 0
14:09:51.872983 IP mailserver-rspamd.mailserver.svc.cluster.local.11332 > mailserver-postfix-7cc47f5458-wj5js.47420: Flags [P.], seq 1:18, ack 18, win 217, options [nop,nop,TS val 175746563 ecr 175746563], length 17
14:09:51.872997 IP mailserver-postfix-7cc47f5458-wj5js.47420 > mailserver-rspamd.mailserver.svc.cluster.local.11332: Flags [.], ack 18, win 219, options [nop,nop,TS val 175746563 ecr 175746563], length 0
14:09:51.873065 IP mailserver-postfix-7cc47f5458-wj5js.47420 > mailserver-rspamd.mailserver.svc.cluster.local.11332: Flags [P.], seq 18:143, ack 18, win 219, options [nop,nop,TS val 175746563 ecr 175746563], length 125
14:09:51.873089 IP mailserver-postfix-7cc47f5458-wj5js.47420 > mailserver-rspamd.mailserver.svc.cluster.local.11332: Flags [F.], seq 143, ack 18, win 219, options [nop,nop,TS val 175746563 ecr 175746563], length 0
14:09:51.873175 IP mailserver-rspamd.mailserver.svc.cluster.local.11332 > mailserver-postfix-7cc47f5458-wj5js.47420: Flags [F.], seq 18, ack 144, win 217, options [nop,nop,TS val 175746563 ecr 175746563], length 0
14:09:51.873189 IP mailserver-postfix-7cc47f5458-wj5js.47420 > mailserver-rspamd.mailserver.svc.cluster.local.11332: Flags [.], ack 19, win 219, options [nop,nop,TS val 175746563 ecr 175746563], length 0

14:09:53.456444 IP 192-168-152-4.mailserver-front.mailserver.svc.cluster.local.33700 > mailserver-postfix-7cc47f5458-wj5js.25: Flags [F.], seq 1, ack 1, win 219, options [nop,nop,TS val 175746959 ecr 175731957], length 0
14:09:53.463948 IP mailserver-postfix-7cc47f5458-wj5js.25 > 192-168-152-4.mailserver-front.mailserver.svc.cluster.local.33700: Flags [.], ack 2, win 217, options [nop,nop,TS val 175746961 ecr 175746959], length 0

^C
52 packets captured
52 packets received by filter
0 packets dropped by kernel
```

When running smtp -v, I found that it wasn't outputting any logs, as if the connection has ceased to exist (which is what I understand from the tcpdump)

The installation is running on k8s, with IPv4. Storage is over NAS (I've checked its performance and it isn't slow). I'm happy to provide cluster access if this helps.

**Comment by UbiquitousBear** [comment]
I ran tcpdump against the postfix container:

```
bash-5.0# tcpdump
tcpdump: verbose output suppressed, use -v or -vv for full protocol decode
listening on eth0, link-type EN10MB (Ethernet), capture size 262144 bytes
14:08:53.448109 IP 192-168-152-4.mailserver-front.mailserver.svc.cluster.local.33700 > mailserver-postfix-7cc47f5458-wj5js.25: Flags [S], seq 3427307910, win 28000, options [mss 1400,sackOK,TS val 175731957 ecr 0,nop,wscale 7], length 0
14:08:53.448125 IP mailserver-postfix-7cc47f5458-wj5js.25 > 192-168-152-4.mailserver-front.mailserver.svc.cluster.local.33700: Flags [S.], seq 1604122734, ack 3427307911, win 27760, options [mss 1400,sackOK,TS val 175731957 ecr 175731957,nop,wscale 7], length 0
14:08:53.448142 IP 192-168-152-4.mailserver-front.mailserver.svc.cluster.local.33700 > mailserver-postfix-7cc47f5458-wj5js.25: Flags [.], ack 1, win 219, options [nop,nop,TS val 175731957 ecr 175731957], length 0
14:08:53.448220 IP mailserver-postfix-7cc47f5458-wj5js.40478 > kube-dns.kube-system.svc.cluster.local.53: 64814+ PTR? 4.152.168.192.in-addr.arpa. (44)
14:08:53.448367 IP kube-dns.kube-system.svc.cluster.local.53 > mailserver-postfix-7cc47f5458-wj5js.40478: 64814*- 1/0/0 PTR 192-168-152-4.mailserver-front.mailserver.svc.cluster.local. (143)
14:08:53.448407 IP mailserver-postfix-7cc47f5458-wj5js.34244 > kube-dns.kube-system.svc.cluster.local.53: 3740+ PTR? 4.152.168.192.in-addr.arpa. (44)
14:08:53.448542 IP kube-dns.kube-system.svc.cluster.local.53 > mailserver-postfix-7cc47f5458-wj5js.34244: 3740*- 1/0/0 PTR 192-168-152-4.mailserver-front.mailserver.svc.cluster.local. (143)
14:08:53.448641 IP mailserver-postfix-7cc47f5458-wj5js.58958 > kube-dns.kube-system.svc.cluster.local.53: 41615+ PTR? 10.0.96.10.in-addr.arpa. (41)
14:08:53.448747 IP kube-dns.kube-system.svc.cluster.local.53 > mailserver-postfix-7cc47f5458-wj5js.58958: 41615*- 1/0/0 PTR kube-dns.kube-system.svc.cluster.local. (116)




14:08:55.539992 ARP, Request who-has mailserver-postfix-7cc47f5458-wj5js tell ingress-nginx-controller.ingress-nginx.svc.cluster.local, length 28
14:08:55.540033 ARP, Reply mailserver-postfix-7cc47f5458-wj5js is-at c2:b8:e1:bb:31:31 (oui Unknown), length 28
14:08:55.540135 IP mailserver-postfix-7cc47f5458-wj5js.57862 > kube-dns.kube-system.svc.cluster.local.53: 31076+ PTR? 119.118.77.51.in-addr.arpa. (44)
14:08:55.540355 IP kube-dns.kube-system.svc.cluster.local.53 > mailserver-postfix-7cc47f5458-wj5js.57862: 31076*- 1/0/0 PTR ingress-nginx-controller.ingress-nginx.svc.cluster.local. (140)




14:09:21.152323 IP mailserver-postfix-7cc47f5458-wj5js.41557 > kube-dns.kube-system.svc.cluster.local.53: 61094+ A? mailserver-rspamd.mailserver.svc.cluster.local. (64)
14:09:21.152391 IP mailserver-postfix-7cc47f5458-wj5js.41557 > kube-dns.kube-system.svc.cluster.local.53: 61398+ AAAA? mailserver-rspamd.mailserver.svc.cluster.local. (64)
14:09:21.152603 IP kube-dns.kube-system.svc.cluster.local.53 > mailserver-postfix-7cc47f5458-wj5js.41557: 61398*- 0/1/0 (157)
14:09:21.152646 IP kube-dns.kube-system.svc.cluster.local.53 > mailserver-postfix-7cc47f5458-wj5js.41557: 61094*- 1/0/0 A 10.110.75.220 (126)
14:09:21.152682 IP mailserver-postfix-7cc47f5458-wj5js.46490 > mailserver-rspamd.mailserver.svc.cluster.local.11332: Flags [S], seq 4008078250, win 28000, options [mss 1400,sackOK,TS val 175738883 ecr 0,nop,wscale 7], length 0
14:09:21.152737 IP mailserver-rspamd.mailserver.svc.cluster.local.11332 > mailserver-postfix-7cc47f5458-wj5js.46490: Flags [S.], seq 98035333, ack 4008078251, win 27760, options [mss 1400,sackOK,TS val 175738883 ecr 175738883,nop,wscale 7], length 0
14:09:21.152747 IP mailserver-postfix-7cc47f5458-wj5js.46490 > mailserver-rspamd.mailserver.svc.cluster.local.11332: Flags [.], ack 1, win 219, options [nop,nop,TS val 175738883 ecr 175738883], length 0
14:09:21.152753 IP mailserver-postfix-7cc47f5458-wj5js.49219 > kube-dns.kube-system.svc.cluster.local.53: 25551+ PTR? 220.75.110.10.in-addr.arpa. (44)
14:09:21.152781 IP mailserver-postfix-7cc47f5458-wj5js.46490 > mailserver-rspamd.mailserver.svc.cluster.local.11332: Flags [P.], seq 1:18, ack 1, win 219, options [nop,nop,TS val 175738883 ecr 175738883], length 17
14:09:21.152791 IP mailserver-rspamd.mailserver.svc.cluster.local.11332 > mailserver-postfix-7cc47f5458-wj5js.46490: Flags [.], ack 18, win 217, options [nop,nop,TS val 175738883 ecr 175738883], length 0
14:09:21.152871 IP mailserver-rspamd.mailserver.svc.cluster.local.11332 > mailserver-postfix-7cc47f5458-wj5js.46490: Flags [P.], seq 1:18, ack 18, win 217, options [nop,nop,TS val 175738883 ecr 175738883], length 17
14:09:21.152879 IP mailserver-postfix-7cc47f5458-wj5js.46490 > mailserver-rspamd.mailserver.svc.cluster.local.11332: Flags [.], ack 18, win 219, options [nop,nop,TS val 175738883 ecr 175738883], length 0
14:09:21.152914 IP kube-dns.kube-system.svc.cluster.local.53 > mailserver-postfix-7cc47f5458-wj5js.49219: 25551*- 1/0/0 PTR mailserver-rspamd.mailserver.svc.cluster.local. (130)
14:09:21.152932 IP mailserver-postfix-7cc47f5458-wj5js.46490 > mailserver-rspamd.mailserver.svc.cluster.local.11332: Flags [P.], seq 18:143, ack 18, win 219, options [nop,nop,TS val 175738883 ecr 175738883], length 125
14:09:21.152944 IP mailserver-postfix-7cc47f5458-wj5js.46490 > mailserver-rspamd.mailserver.svc.cluster.local.11332: Flags [F.], seq 143, ack 18, win 219, options [nop,nop,TS val 175738883 ecr 175738883], length 0
14:09:21.152988 IP mailserver-rspamd.mailserver.svc.cluster.local.11332 > mailserver-postfix-7cc47f5458-wj5js.46490: Flags [F.], seq 18, ack 144, win 217, options [nop,nop,TS val 175738883 ecr 175738883], length 0
14:09:21.152995 IP mailserver-postfix-7cc47f5458-wj5js.46490 > mailserver-rspamd.mailserver.svc.cluster.local.11332: Flags [.], ack 19, win 219, options [nop,nop,TS val 175738883 ecr 175738883], length 0



14:09:46.818754 IP 192-168-152-4.mailserver-front.mailserver.svc.cluster.local.35378 > mailserver-postfix-7cc47f5458-wj5js.25: Flags [S], seq 1578558100, win 28000, options [mss 1400,sackOK,TS val 175745299 ecr 0,nop,wscale 7], length 0
14:09:46.818778 IP mailserver-postfix-7cc47f5458-wj5js.25 > 192-168-152-4.mailserver-front.mailserver.svc.cluster.local.35378: Flags [S.], seq 2953198658, ack 1578558101, win 27760, options [mss 1400,sackOK,TS val 175745299 ecr 175745299,nop,wscale 7], length 0
14:09:46.818798 IP 192-168-152-4.mailserver-front.mailserver.svc.cluster.local.35378 > mailserver-postfix-7cc47f5458-wj5js.25: Flags [.], ack 1, win 219, options [nop,nop,TS val 175745299 ecr 175745299], length 0

14:09:51.859961 ARP, Request who-has mailserver-postfix-7cc47f5458-wj5js tell ingress-nginx-controller.ingress-nginx.svc.cluster.local, length 28
14:09:51.860008 ARP, Reply mailserver-postfix-7cc47f5458-wj5js is-at c2:b8:e1:bb:31:31 (oui Unknown), length 28
14:09:51.872362 IP mailserver-postfix-7cc47f5458-wj5js.47188 > kube-dns.kube-system.svc.cluster.local.53: 985+ A? mailserver-rspamd.mailserver.svc.cluster.local. (64)
14:09:51.872427 IP mailserver-postfix-7cc47f5458-wj5js.47188 > kube-dns.kube-system.svc.cluster.local.53: 1211+ AAAA? mailserver-rspamd.mailserver.svc.cluster.local. (64)
14:09:51.872655 IP kube-dns.kube-system.svc.cluster.local.53 > mailserver-postfix-7cc47f5458-wj5js.47188: 1211*- 0/1/0 (157)
14:09:51.872705 IP kube-dns.kube-system.svc.cluster.local.53 > mailserver-postfix-7cc47f5458-wj5js.47188: 985*- 1/0/0 A 10.110.75.220 (126)
14:09:51.872759 IP mailserver-postfix-7cc47f5458-wj5js.47420 > mailserver-rspamd.mailserver.svc.cluster.local.11332: Flags [S], seq 2342448319, win 28000, options [mss 1400,sackOK,TS val 175746563 ecr 0,nop,wscale 7], length 0
14:09:51.872825 IP mailserver-rspamd.mailserver.svc.cluster.local.11332 > mailserver-postfix-7cc47f5458-wj5js.47420: Flags [S.], seq 754468769, ack 2342448320, win 27760, options [mss 1400,sackOK,TS val 175746563 ecr 175746563,nop,wscale 7], length 0
14:09:51.872840 IP mailserver-postfix-7cc47f5458-wj5js.47420 > mailserver-rspamd.mailserver.svc.cluster.local.11332: Flags [.], ack 1, win 219, options [nop,nop,TS val 175746563 ecr 175746563], length 0
14:09:51.872876 IP mailserver-postfix-7cc47f5458-wj5js.47420 > mailserver-rspamd.mailserver.svc.cluster.local.11332: Flags [P.], seq 1:18, ack 1, win 219, options [nop,nop,TS val 175746563 ecr 175746563], length 17
14:09:51.872889 IP mailserver-rspamd.mailserver.svc.cluster.local.11332 > mailserver-postfix-7cc47f5458-wj5js.47420: Flags [.], ack 18, win 217, options [nop,nop,TS val 175746563 ecr 175746563], length 0
14:09:51.872983 IP mailserver-rspamd.mailserver.svc.cluster.local.11332 > mailserver-postfix-7cc47f5458-wj5js.47420: Flags [P.], seq 1:18, ack 18, win 217, options [nop,nop,TS val 175746563 ecr 175746563], length 17
14:09:51.872997 IP mailserver-postfix-7cc47f5458-wj5js.47420 > mailserver-rspamd.mailserver.svc.cluster.local.11332: Flags [.], ack 18, win 219, options [nop,nop,TS val 175746563 ecr 175746563], length 0
14:09:51.873065 IP mailserver-postfix-7cc47f5458-wj5js.47420 > mailserver-rspamd.mailserver.svc.cluster.local.11332: Flags [P.], seq 18:143, ack 18, win 219, options [nop,nop,TS val 175746563 ecr 175746563], length 125
14:09:51.873089 IP mailserver-postfix-7cc47f5458-wj5js.47420 > mailserver-rspamd.mailserver.svc.cluster.local.11332: Flags [F.], seq 143, ack 18, win 219, options [nop,nop,TS val 175746563 ecr 175746563], length 0
14:09:51.873175 IP mailserver-rspamd.mailserver.svc.cluster.local.11332 > mailserver-postfix-7cc47f5458-wj5js.47420: Flags [F.], seq 18, ack 144, win 217, options [nop,nop,TS val 175746563 ecr 175746563], length 0
14:09:51.873189 IP mailserver-postfix-7cc47f5458-wj5js.47420 > mailserver-rspamd.mailserver.svc.cluster.local.11332: Flags [.], ack 19, win 219, options [nop,nop,TS val 175746563 ecr 175746563], length 0

14:09:53.456444 IP 192-168-152-4.mailserver-front.mailserver.svc.cluster.local.33700 > mailserver-postfix-7cc47f5458-wj5js.25: Flags [F.], seq 1, ack 1, win 219, options [nop,nop,TS val 175746959 ecr 175731957], length 0
14:09:53.463948 IP mailserver-postfix-7cc47f5458-wj5js.25 > 192-168-152-4.mailserver-front.mailserver.svc.cluster.local.33700: Flags [.], ack 2, win 217, options [nop,nop,TS val 175746961 ecr 175746959], length 0

^C
52 packets captured
52 packets received by filter
0 packets dropped by kernel
```

**Comment by kaiyou** [comment]
Front is properly connecting to postfix and postfix is properly connecting to rspamd. So I would say the admin container is running fine since front can connect to it and it answers fine since front ends up contacting postfix.

My next guess would be an issue with podop on the postfix containers. Could you output a bit more logs from Postfix?

**Comment by kaiyou** [comment]
Also, unfortunately podop currently does not take the log level into account.

Could you increase verbosity on your setup by modifying start.py in the container, and increasing the first argument to the `run_server` call.

**Comment by UbiquitousBear** [comment]
To confirm, it should look like:


```
def start_podop():
    os.setuid(100)
    url = "http://" + os.environ["ADMIN_ADDRESS"] + "/internal/postfix/"
    # TODO: Remove verbosity setting from Podop?
    run_server(1, "postfix", "/tmp/podop.socket", [
```

**Comment by kaiyou** [comment]
Exactly like this indeed.

**Comment by UbiquitousBear** [comment]
I tried this but didn't get any extra logs from the container

**Comment by UbiquitousBear** [comment]
@kaiyou I've noticed that whatever level I set, I don't get more information from podop?

**Comment by UbiquitousBear** [comment]
@kaiyou @Nebukadneza any ideas here? I can give you guys access to the cluster to play with

Connected to mail.runway.sh.
Escape character is '^]'.
220 mail.runway.sh ESMTP ready
EHLO keeper-us-east-1b.mxtoolbox.com
250-mail.runway.sh
250-PIPELINING
250-SIZE
250-52428800
250-ETRN
250-ENHANCEDSTATUSCODES
250-8BITMIME
250-DSN
250-CHUNKING
250 STARTTLS
MAIL FROM:<supertool@mxtoolbox.com>
250 2.0.0 OK
RCPT TO:<test@mxtoolboxsmtpdiag.com>
554 5.7.1 <test@mxtoolboxsmtpdiag.com>: Relay access denied // this took 19 seconds for example

**Comment by Nebukadneza** [comment]
Hi There,

The `Mailu`-Project is currently in a bit of a bind! We are short on man-power, and we need to judge if it is possible for us to put in some work on this issue.

To help with that, we are currently trying to find out which issues are actively keeping users from using `Mailu`, which issues have someone who want to work on them — and which issues may be less important. These a less important ones could be discarded for the time being, until the project is in a more stable and regular state once again.

In order for us to better assess this, it would be helpful if you could put a **reaction on this post** (use the :smiley: icon to the top-right).
- 👍️ if you **need this** to be able to use Mailu. Ideally, you’d also be able to test this on your installation, and provide feedback …
- 🎉 if you find it a **nice bonus**, but no deal-breaker
- 🚀 if you want to **work on it yourself**!
We want to keep this **voting open for 2 weeks** from now, so please help out!

**Comment by UbiquitousBear** [comment]
I've tried playing around with the storage and it looks like this might be related to the fact that I had the storage on a NAS appliance. After migrating the data to a node host, it seems to work fine, albeit this is not a permanent solution. 

I wonder what makes storage calls in the process?

**Comment by Diman0** [comment]
I cannot replicate this with 1.9. I'm closing this. If people still have this issue, we can create a new issue for version 1.9 and continue there.
