### ISSUE TITLE
mail-letsencrypt -> front --> Invalid response from http://mail.example.fr/

### ISSUE THREAD

**Issue by hub2rock** [Mailu/Mailu#2966]
### Environment

- [*] docker compose

### Version

- Version: `master` 2.0

## Description

After setting up Mailu behind a reverse proxy with the mail-letsencrypt TLS setting, I cannot renew my certificates.

After checking the logs for the front container, I get Error: 
```
Certbot failed to authenticate some domains (authenticator: standalone). The Certificate Authority reported these problems:
  Domain: mail.example.fr
  Type:   unauthorized
  Detail: XXX.XXX.XXX.XXX: Invalid response from http://mail.example.fr/.well-known/acme-challenge/jw_V7ZveSz5gp2Gypw6et4LczGynp8veedfJ5f4-AF4: 404
```
## Replication Steps

1. Rebuild Mailu using the docker-compose settings below
2. Try to add an account in my client => Certificate is expired

## Expected behaviour

Certificate renewal

## Logs

```
2023-10-06 13:55:02,423:DEBUG:acme.client:Received response:
HTTP 200
Server: nginx
Date: Fri, 06 Oct 2023 13:55:02 GMT
Content-Type: application/json
Content-Length: 1026
Connection: keep-alive
Boulder-Requester: 405748950
Cache-Control: public, max-age=0, no-cache
Link: <https://acme-v02.api.letsencrypt.org/directory>;rel="index"
Replay-Nonce: 3hclikJOYQeRqfKi-jIPScoJJR3C-lh4lt7atk0b2yydJ2qurDI
X-Frame-Options: DENY
Strict-Transport-Security: max-age=604800

{
  "identifier": {
    "type": "dns",
    "value": "mail.example.fr"
  },
  "status": "invalid",
  "expires": "2023-10-13T13:54:59Z",
  "challenges": [
    {
      "type": "http-01",
      "status": "invalid",
      "error": {
        "type": "urn:ietf:params:acme:error:unauthorized",
        "detail": "XXX.XXX.XXX.XXX: Invalid response from http://mail.example.fr/.well-known/acme-challenge/jw_V7ZveSz5gp2Gypw6et4LczGynp8veedfJ5f4-AF4: 404",
        "status": 403
      },
      "url": "https://acme-v02.api.letsencrypt.org/acme/chall-v3/271292522506/NQsvZw",
      "token": "jw_V7ZveSz5gp2Gypw6et4LczGynp8veedfJ5f4-AF4",
      "validationRecord": [
        {
          "url": "http://mail.example.fr/.well-known/acme-challenge/jw_V7ZveSz5gp2Gypw6et4LczGynp8veedfJ5f4-AF4",
          "hostname": "mail.example.fr",
          "port": "80",
          "addressesResolved": [
            "XXX.XXX.XXX.XXX"
          ],
          "addressUsed": "XXX.XXX.XXX.XXX"
        }
      ],
      "validated": "2023-10-06T13:55:00Z"
    }
  ]
}
2023-10-06 13:55:02,424:DEBUG:acme.client:Storing nonce: 3hclikJOYQeRqfKi-jIPScoJJR3C-lh4lt7atk0b2yydJ2qurDI
2023-10-06 13:55:02,424:INFO:certbot._internal.auth_handler:Challenge failed for domain mail.example.fr
```

### mailu.env:

```
# Mailu main configuration file
#
# This file is autogenerated by the configuration management wizard for compose flavor.
# For a detailed list of configuration variables, see the documentation at
# https://mailu.io

###################################
# Common configuration variables
###################################

# Set to a randomly generated 16 bytes string
SECRET_KEY=REDACTED4PRIVACY

# Subnet of the docker network. This should not conflict with any networks to which your system is connected. (Internal and external!)
SUBNET=192.168.203.0/24

# Main mail domain
DOMAIN=2rock.fr

# Hostnames for this server, separated with comas
HOSTNAMES=mail.example.fr,autoconfig.example.fr,autoconfig.example.fr

# Postmaster local part (will append the main mail domain)
POSTMASTER=admin

# Choose how secure connections will behave (value: letsencrypt, cert, notls, mail, mail-letsencrypt)
TLS_FLAVOR=mail-letsencrypt

# Authentication rate limit per IP (per /24 on ipv4 and /48 on ipv6)
AUTH_RATELIMIT_IP=5/hour

# Authentication rate limit per user (regardless of the source-IP)
AUTH_RATELIMIT_USER=10/day

#
AUTH_RATELIMIT_EXEMPTION_LENGTH=86400

# Opt-out of statistics, replace with "True" to opt out
DISABLE_STATISTICS=True

###################################
# Optional features
###################################

# Expose the admin interface (value: true, false)
ADMIN=true

# Choose which webmail to run if any (values: roundcube, snappymail, none)
WEBMAIL=roundcube

# Expose the API interface (value: true, false)
API=true

# Dav server implementation (value: radicale, none)
WEBDAV=radicale

# Antivirus solution (value: clamav, none)
ANTIVIRUS=clamav

# Scan Macros solution (value: true, false)
SCAN_MACROS=true

###################################
# Mail settings
###################################

# Message size limit in bytes
# Default: accept messages up to 50MB
# Max attachment size will be 33% smaller
MESSAGE_SIZE_LIMIT=50000000

# Message rate limit (per user)
MESSAGE_RATELIMIT=200/day

# Networks granted relay permissions
# Use this with care, all hosts in this networks will be able to send mail without authentication!
RELAYNETS=

# Will relay all outgoing mails if configured
RELAYHOST=

# Enable fetchmail
FETCHMAIL_ENABLED=true

# Fetchmail delay
FETCHMAIL_DELAY=600

# Recipient delimiter, character used to delimiter localpart from custom address part
RECIPIENT_DELIMITER=+

# DMARC rua and ruf email
DMARC_RUA=admin
DMARC_RUF=admin

# Welcome email, enable and set a topic and body if you wish to send welcome
# emails to all users.
WELCOME=false
WELCOME_SUBJECT=Welcome to your new email account
WELCOME_BODY=Welcome to your new email account, if you can read this, then it is configured properly!

# Maildir Compression
# choose compression-method, default: none (value: gz, bz2, zstd)
COMPRESSION=bz2
# change compression-level, default: 6 (value: 1-9)
COMPRESSION_LEVEL=6

# IMAP full-text search is enabled by default. Set the following variable to off in order to disable the feature.
# FULL_TEXT_SEARCH=off

###################################
# Web settings
###################################

# Path to redirect / to
WEBROOT_REDIRECT=/webmail

# Path to the admin interface if enabled
WEB_ADMIN=/admin

# Path to the webmail if enabled
WEB_WEBMAIL=/webmail

# Path to the API interface if enabled
WEB_API=/api

# Website name
SITENAME=Mailu

# Linked Website URL
WEBSITE=https://example.Fr



###################################
# Advanced settings
###################################

# Docker-compose project name, this will prepended to containers names.
COMPOSE_PROJECT_NAME=mailu

# Number of rounds used by the password hashing scheme
CREDENTIAL_ROUNDS=12

# Header to take the real ip from
REAL_IP_HEADER=X-Real-IP

# IPs for nginx set_real_ip_from (CIDR list separated by commas)
REAL_IP_FROM=10.0.0.3

# choose wether mailu bounces (no) or rejects (yes) mail when recipient is unknown (value: yes, no)
REJECT_UNLISTED_RECIPIENT=

# Log level threshold in start.py (value: CRITICAL, ERROR, WARNING, INFO, DEBUG, NOTSET)
LOG_LEVEL=INFO

# Timezone for the Mailu containers. See this link for all possible values https://en.wikipedia.org/wiki/List_of_tz_database_time_zones
TZ=Etc/UTC

# Default spam threshold used for new users
DEFAULT_SPAM_THRESHOLD=80

# API token required for authenticating to the RESTful API.
# This is a mandatory setting for using the RESTful API.
API_TOKEN=REDACTED4PRIVACY
```

### docker-compose.yml:

```
*# This file is auto-generated by the Mailu configuration wizard.
# Please read the documentation before attempting any change.
# Generated for compose flavor

version: '2.2'

services:

  # External dependencies
  redis:
    image: redis:alpine
    restart: always
    volumes:
      - "/opt/mailu/redis:/data"
    depends_on:
      - resolver
    dns:
      - 192.168.203.254

  # Core services
  front:
    image: ${DOCKER_ORG:-ghcr.io/mailu}/${DOCKER_PREFIX:-}nginx:${MAILU_VERSION:-2.0}
    restart: always
    env_file: mailu.env
    logging:
      driver: journald
      options:
        tag: mailu-front
    ports:
      - "10.0.0.5:80:80"
      - "10.0.0.5:443:443"
      - "10.0.0.5:25:25"
      - "10.0.0.5:465:465"
      - "10.0.0.5:587:587"
      - "10.0.0.5:110:110"
      - "10.0.0.5:995:995"
      - "10.0.0.5:143:143"
      - "10.0.0.5:993:993"
    networks:
      - default
      - webmail
      - radicale
    volumes:
      - "/opt/mailu/certs:/certs"
      - "/opt/mailu/overrides/nginx:/overrides:ro"
    depends_on:
      - resolver
    dns:
      - 192.168.203.254

  resolver:
    image: ${DOCKER_ORG:-ghcr.io/mailu}/${DOCKER_PREFIX:-}unbound:${MAILU_VERSION:-2.0}
    env_file: mailu.env
    restart: always
    networks:
      default:
        ipv4_address: 192.168.203.254

  admin:
    image: ${DOCKER_ORG:-ghcr.io/mailu}/${DOCKER_PREFIX:-}admin:${MAILU_VERSION:-2.0}
    restart: always
    env_file: mailu.env
    logging:
      driver: journald
      options:
        tag: mailu-admin
    volumes:
      - "/opt/mailu/data:/data"
      - "/opt/mailu/dkim:/dkim"
    depends_on:
      - redis
      - resolver
    dns:
      - 192.168.203.254

  imap:
    image: ${DOCKER_ORG:-ghcr.io/mailu}/${DOCKER_PREFIX:-}dovecot:${MAILU_VERSION:-2.0}
    restart: always
    env_file: mailu.env
    logging:
      driver: journald
      options:
        tag: mailu-imap
    volumes:
      - "/opt/mailu/mail:/mail"
      - "/opt/mailu/overrides/dovecot:/overrides:ro"
    depends_on:
      - front
      - resolver
    dns:
      - 192.168.203.254

  smtp:
    image: ${DOCKER_ORG:-ghcr.io/mailu}/${DOCKER_PREFIX:-}postfix:${MAILU_VERSION:-2.0}
    restart: always
    env_file: mailu.env
    logging:
      driver: journald
      options:
        tag: mailu-smtp
    volumes:
      - "/opt/mailu/mailqueue:/queue"
      - "/opt/mailu/overrides/postfix:/overrides:ro"
    depends_on:
      - front
      - resolver
    dns:
      - 192.168.203.254

  oletools:
    image: ${DOCKER_ORG:-ghcr.io/mailu}/${DOCKER_PREFIX:-}oletools:${MAILU_VERSION:-2.0}
    hostname: oletools
    restart: always
    networks:
      - noinet
    depends_on:
      - resolver
    dns:
      - 192.168.203.254

  antispam:
    image: ${DOCKER_ORG:-ghcr.io/mailu}/${DOCKER_PREFIX:-}rspamd:${MAILU_VERSION:-2.0}
    hostname: antispam
    restart: always
    env_file: mailu.env
    logging:
      driver: journald
      options:
        tag: mailu-antispam
    networks:
      - default
      - noinet
    volumes:
      - "/opt/mailu/filter:/var/lib/rspamd"
      - "/opt/mailu/overrides/rspamd:/overrides:ro"
    depends_on:
      - front
      - redis
      - oletools
      - antivirus
      - resolver
    dns:
      - 192.168.203.254

  # Optional services
  antivirus:
    image: ${DOCKER_ORG:-ghcr.io/mailu}/${DOCKER_PREFIX:-}clamav:${MAILU_VERSION:-2.0}
    restart: always
    env_file: mailu.env
    volumes:
      - "/opt/mailu/filter:/data"
    depends_on:
      - resolver
    dns:
      - 192.168.203.254

  webdav:
    image: ${DOCKER_ORG:-ghcr.io/mailu}/${DOCKER_PREFIX:-}radicale:${MAILU_VERSION:-2.0}
    restart: always
    volumes:
      - "/opt/mailu/dav:/data"
    networks:
      - radicale

  fetchmail:
    image: ${DOCKER_ORG:-ghcr.io/mailu}/${DOCKER_PREFIX:-}fetchmail:${MAILU_VERSION:-2.0}
    restart: always
    env_file: mailu.env
    volumes:
      - "/opt/mailu/data/fetchmail:/data"
    depends_on:
      - admin
      - smtp
      - imap
      - resolver
    dns:
      - 192.168.203.254

  # Webmail
  webmail:
    image: ${DOCKER_ORG:-ghcr.io/mailu}/${DOCKER_PREFIX:-}webmail:${MAILU_VERSION:-2.0}
    restart: always
    env_file: mailu.env
    volumes:
      - "/opt/mailu/webmail:/data"
      - "/opt/mailu/overrides/roundcube:/overrides:ro"
    networks:
      - webmail
    depends_on:
      - front

networks:
  default:
    driver: bridge
    ipam:
      driver: default
      config:
        - subnet: 192.168.203.0/24
  radicale:
    driver: bridge
  webmail:
    driver: bridge
  noinet:
    driver: bridge
    internal: true
```

### nginx reverse proxy configuration mail.example.fr.conf

```
server {
        server_name mail.example.fr;

        listen 80;
        listen [::]:80;

        location ^~ /.well-known/acme-challenge/ {
                #alias /var/www/html/mail.example.fr/.well-know;
                proxy_pass http://10.0.0.5/.well-known/acme-challenge/;
                proxy_set_header Host $host;
        }

        location / {
                return 301 https://$host$request_uri;
        }
}

server {
        server_name mail.example.fr;

        listen 443 ssl http2;
        listen [::]:443 ssl http2;

        location / {
                rewrite / https://mail.example.fr/webmail redirect;
        }

        location ~* ^/(admin|api|sso|static|webdav|webmail|(apple\.)?mobileconfig|(\.well\-known/autoconfig/)?mail/|Autodiscover/Autodiscover) {
                proxy_set_header Host $host;
                proxy_set_header X-Real-IP $remote_addr;
                proxy_pass https://10.0.0.5;
        }

        proxy_set_header Host $host;
        proxy_set_header X-Real-IP $remote_addr;
        proxy_set_header X-Forwarded-For $proxy_add_x_forwarded_for;
        proxy_set_header X-Forwarded-Proto $scheme;
        proxy_headers_hash_max_size 512;
        proxy_headers_hash_bucket_size 128;

        add_header Strict-Transport-Security "max-age=31536000; includeSubDomains; preload";
        client_max_body_size 0;

        ssl_certificate /etc/letsencrypt/live/mail.example.fr/fullchain.pem;
        ssl_certificate_key /etc/letsencrypt/live/mail.example.fr/privkey.pem;
        ssl_trusted_certificate /etc/letsencrypt/live/mail.example.fr/chain.pem;

        include /etc/nginx/snippets/header.conf;
        include /etc/nginx/snippets/ssl.conf;

        access_log /var/log/nginx/mail.example.fr.access.log;
        error_log /var/log/nginx/mail.example.fr.error.log;
}
```
### DNS configuration

![Sans titre-1](https://github.com/Mailu/Mailu/assets/2854830/b05b8875-630e-4552-afc0-d12a683bda09)

**Comment by nextgens** [comment]
It's most likely your reverse proxy's configuration.

You have a single ``server_name`` defined for each block whereas you have multiple in ``HOSTNAMES`` and ``DOMAIN``. Add the missing ones and it should start working.

If it doesn't, use tcpdump and try to find out how far the request on port 80 goes: is it going past your reverse proxy? is it going past front and to port 8008 like it ought to?

**Comment by leolivier** [comment]
Hi,
With pretty much the same setup, I have a quite similar problem except that I don't get a 404 error but:
`  Detail: 176.169.226.136: Fetching https://mail.<my.tld>/.well-known/acme-challenge/XmK67mSCmG1J6C4bs0xRV2YtUnn0GGqcOxj2Fi4W8aM: Timeout during connect (likely firewall problem)`

What is strange is that SnappyMail and BlueMail on Android can still fetch emails but Thunderbird on Windows 11 cannot...

Absolutely newbie on tcpdump, so I installed it inside the front and ran the following commands then tried accessing thes acme-challenge file:
```
fa436d9cd133:/app# tcpdump 'tcp port 80'
tcpdump: verbose output suppressed, use -v[v]... for full protocol decode
listening on eth0, link-type EN10MB (Ethernet), snapshot length 262144 bytes
16:45:25.456475 IP 192.168.1.8.52654 > fa436d9cd133.80: Flags [S], seq 4249268281, win 65495, options [mss 65495,sackOK,TS val 2090814195 ecr 0,nop,wscale 7], length 0
16:45:25.456530 IP fa436d9cd133.80 > 192.168.1.8.52654: Flags [S.], seq 3382545757, ack 4249268282, win 65160, options [mss 1460,sackOK,TS val 39509649 ecr 2090814195,nop,wscale 7], length 0
16:45:25.456600 IP 192.168.1.8.52654 > fa436d9cd133.80: Flags [.], ack 1, win 512, options [nop,nop,TS val 2090814195 ecr 39509649], length 0
16:45:25.456729 IP 192.168.1.8.52654 > fa436d9cd133.80: Flags [P.], seq 1:1202, ack 1, win 512, options [nop,nop,TS val 2090814195 ecr 39509649], length 1201: HTTP: GET /.well-known/acme-challenge/XmK67mSCmG1J6C4bs0xRV2YtUnn0GGqcOxj2Fi4W8aM HTTP/1.1
16:45:25.456746 IP fa436d9cd133.80 > 192.168.1.8.52654: Flags [.], ack 1202, win 501, options [nop,nop,TS val 39509649 ecr 2090814195], length 0
16:45:25.457271 IP fa436d9cd133.80 > 192.168.1.8.52654: Flags [P.], seq 1:301, ack 1202, win 501, options [nop,nop,TS val 39509650 ecr 2090814195], length 300: HTTP: HTTP/1.1 502 Bad Gateway
16:45:25.457355 IP 192.168.1.8.52654 > fa436d9cd133.80: Flags [.], ack 301, win 510, options [nop,nop,TS val 2090814196 ecr 39509650], length 0
16:45:25.568637 IP 192.168.1.8.52662 > fa436d9cd133.80: Flags [S], seq 1766578088, win 65495, options [mss 65495,sackOK,TS val 2090814307 ecr 0,nop,wscale 7], length 0
16:45:25.568693 IP fa436d9cd133.80 > 192.168.1.8.52662: Flags [S.], seq 2807181224, ack 1766578089, win 65160, options [mss 1460,sackOK,TS val 39509761 ecr 2090814307,nop,wscale 7], length 0
16:45:25.568764 IP 192.168.1.8.52662 > fa436d9cd133.80: Flags [.], ack 1, win 512, options [nop,nop,TS val 2090814307 ecr 39509761], length 0
16:45:25.568904 IP 192.168.1.8.52662 > fa436d9cd133.80: Flags [P.], seq 1:1090, ack 1, win 512, options [nop,nop,TS val 2090814307 ecr 39509761], length 1089: HTTP: GET /robots.txt HTTP/1.1
16:45:25.568921 IP fa436d9cd133.80 > 192.168.1.8.52662: Flags [.], ack 1090, win 501, options [nop,nop,TS val 39509761 ecr 2090814307], length 0
16:45:25.569410 IP fa436d9cd133.80 > 192.168.1.8.52662: Flags [P.], seq 1:433, ack 1090, win 501, options [nop,nop,TS val 39509762 ecr 2090814307], length 432: HTTP: HTTP/1.1 200 OK
16:45:25.569476 IP 192.168.1.8.52662 > fa436d9cd133.80: Flags [.], ack 433, win 509, options [nop,nop,TS val 2090814308 ecr 39509762], length 0
16:45:25.569533 IP fa436d9cd133.80 > 192.168.1.8.52662: Flags [P.], seq 433:479, ack 1090, win 501, options [nop,nop,TS val 39509762 ecr 2090814308], length 46: HTTP
16:45:25.569575 IP 192.168.1.8.52662 > fa436d9cd133.80: Flags [.], ack 479, win 509, options [nop,nop,TS val 2090814308 ecr 39509762], length 0
^C
16 packets captured
16 packets received by filter
0 packets dropped by kernel
fa436d9cd133:/app# tcpdump 'tcp port 8008'
tcpdump: verbose output suppressed, use -v[v]... for full protocol decode
listening on eth0, link-type EN10MB (Ethernet), snapshot length 262144 bytes
^C
0 packets captured
0 packets received by filter
0 packets dropped by kernel
```
So nothing on port 8008, and I don't know how to interpret the one on port 80...

**Comment by leolivier** [comment]
Also, as the message says it's likely a friewall issue, I cleared all my iptables rules and recreated them with basic access to the needed ports, but now I have still the same issue and the rules are quite complex (managed by Docker and fail2ban I suppose):
```
pi@raspberrypi ~ $ sudo iptables -L
Chain INPUT (policy ACCEPT)
target     prot opt source               destination
f2b-sshd   tcp  --  anywhere             anywhere             multiport dports ssh
ACCEPT     all  --  anywhere             anywhere
ACCEPT     tcp  --  anywhere             anywhere             tcp dpt:http
ACCEPT     tcp  --  anywhere             anywhere             tcp dpt:ssh
ACCEPT     tcp  --  anywhere             anywhere             tcp dpt:https
ACCEPT     tcp  --  anywhere             anywhere             tcp dpt:8443
ACCEPT     tcp  --  anywhere             anywhere             tcp dpt:9443
ACCEPT     tcp  --  anywhere             anywhere             tcp dpt:pop3s
ACCEPT     tcp  --  anywhere             anywhere             tcp dpt:smtp
ACCEPT     tcp  --  anywhere             anywhere             tcp dpt:submissions
ACCEPT     tcp  --  anywhere             anywhere             tcp dpt:submission
ACCEPT     tcp  --  anywhere             anywhere             tcp dpt:pop3
ACCEPT     tcp  --  anywhere             anywhere             tcp dpt:imap2
ACCEPT     tcp  --  anywhere             anywhere             tcp dpt:imaps

Chain FORWARD (policy ACCEPT)
target     prot opt source               destination
DOCKER-USER  all  --  anywhere             anywhere
DOCKER-ISOLATION-STAGE-1  all  --  anywhere             anywhere
ACCEPT     all  --  anywhere             anywhere             ctstate RELATED,ESTABLISHED
DOCKER     all  --  anywhere             anywhere
ACCEPT     all  --  anywhere             anywhere
ACCEPT     all  --  anywhere             anywhere
ACCEPT     all  --  anywhere             anywhere             ctstate RELATED,ESTABLISHED
DOCKER     all  --  anywhere             anywhere
ACCEPT     all  --  anywhere             anywhere
ACCEPT     all  --  anywhere             anywhere
ACCEPT     all  --  anywhere             anywhere             ctstate RELATED,ESTABLISHED
DOCKER     all  --  anywhere             anywhere
ACCEPT     all  --  anywhere             anywhere
ACCEPT     all  --  anywhere             anywhere
ACCEPT     all  --  anywhere             anywhere             ctstate RELATED,ESTABLISHED
DOCKER     all  --  anywhere             anywhere
ACCEPT     all  --  anywhere             anywhere
ACCEPT     all  --  anywhere             anywhere
ACCEPT     all  --  anywhere             anywhere             ctstate RELATED,ESTABLISHED
DOCKER     all  --  anywhere             anywhere
ACCEPT     all  --  anywhere             anywhere
ACCEPT     all  --  anywhere             anywhere
ACCEPT     all  --  anywhere             anywhere
ACCEPT     all  --  anywhere             anywhere             ctstate RELATED,ESTABLISHED
DOCKER     all  --  anywhere             anywhere
ACCEPT     all  --  anywhere             anywhere
ACCEPT     all  --  anywhere             anywhere
ACCEPT     all  --  anywhere             anywhere             ctstate RELATED,ESTABLISHED
DOCKER     all  --  anywhere             anywhere
ACCEPT     all  --  anywhere             anywhere
ACCEPT     all  --  anywhere             anywhere
ACCEPT     all  --  anywhere             anywhere             ctstate RELATED,ESTABLISHED
DOCKER     all  --  anywhere             anywhere
ACCEPT     all  --  anywhere             anywhere
ACCEPT     all  --  anywhere             anywhere
ACCEPT     all  --  anywhere             anywhere             ctstate RELATED,ESTABLISHED
DOCKER     all  --  anywhere             anywhere
ACCEPT     all  --  anywhere             anywhere
ACCEPT     all  --  anywhere             anywhere
ACCEPT     all  --  anywhere             anywhere             ctstate RELATED,ESTABLISHED
DOCKER     all  --  anywhere             anywhere
ACCEPT     all  --  anywhere             anywhere
ACCEPT     all  --  anywhere             anywhere
ACCEPT     all  --  anywhere             anywhere             ctstate RELATED,ESTABLISHED
DOCKER     all  --  anywhere             anywhere
ACCEPT     all  --  anywhere             anywhere
ACCEPT     all  --  anywhere             anywhere
ACCEPT     all  --  anywhere             anywhere             ctstate RELATED,ESTABLISHED
DOCKER     all  --  anywhere             anywhere
ACCEPT     all  --  anywhere             anywhere
ACCEPT     all  --  anywhere             anywhere
ACCEPT     all  --  anywhere             anywhere             ctstate RELATED,ESTABLISHED
DOCKER     all  --  anywhere             anywhere
ACCEPT     all  --  anywhere             anywhere
ACCEPT     all  --  anywhere             anywhere
ACCEPT     all  --  anywhere             anywhere             ctstate RELATED,ESTABLISHED
DOCKER     all  --  anywhere             anywhere
ACCEPT     all  --  anywhere             anywhere
ACCEPT     all  --  anywhere             anywhere

Chain OUTPUT (policy ACCEPT)
target     prot opt source               destination

Chain DOCKER (14 references)
target     prot opt source               destination
ACCEPT     tcp  --  anywhere             172.24.0.2           tcp dpt:51515
ACCEPT     tcp  --  anywhere             172.23.0.2           tcp dpt:8083
ACCEPT     tcp  --  anywhere             172.26.0.2           tcp dpt:4533
ACCEPT     tcp  --  anywhere             172.29.0.2           tcp dpt:9443
ACCEPT     tcp  --  anywhere             172.29.0.2           tcp dpt:8000
ACCEPT     tcp  --  anywhere             172.18.0.3           tcp dpt:http
ACCEPT     tcp  --  anywhere             172.20.0.4           tcp dpt:http
ACCEPT     tcp  --  anywhere             192.168.203.2        tcp dpt:https
ACCEPT     tcp  --  anywhere             192.168.203.2        tcp dpt:http
ACCEPT     tcp  --  anywhere             192.168.203.2        tcp dpt:pop3s
ACCEPT     tcp  --  anywhere             192.168.203.2        tcp dpt:imaps
ACCEPT     tcp  --  anywhere             192.168.203.2        tcp dpt:submission
ACCEPT     tcp  --  anywhere             192.168.203.2        tcp dpt:submissions
ACCEPT     tcp  --  anywhere             192.168.203.2        tcp dpt:imap2
ACCEPT     tcp  --  anywhere             192.168.203.2        tcp dpt:pop3
ACCEPT     tcp  --  anywhere             192.168.203.2        tcp dpt:smtp

Chain DOCKER-ISOLATION-STAGE-1 (1 references)
target     prot opt source               destination
DOCKER-ISOLATION-STAGE-2  all  --  anywhere             anywhere
DOCKER-ISOLATION-STAGE-2  all  --  anywhere             anywhere
DOCKER-ISOLATION-STAGE-2  all  --  anywhere             anywhere
DOCKER-ISOLATION-STAGE-2  all  --  anywhere             anywhere
DOCKER-ISOLATION-STAGE-2  all  --  anywhere             anywhere
DROP       all  -- !172.25.0.0/16        anywhere
DROP       all  --  anywhere            !172.25.0.0/16
DOCKER-ISOLATION-STAGE-2  all  --  anywhere             anywhere
DOCKER-ISOLATION-STAGE-2  all  --  anywhere             anywhere
DOCKER-ISOLATION-STAGE-2  all  --  anywhere             anywhere
DOCKER-ISOLATION-STAGE-2  all  --  anywhere             anywhere
DOCKER-ISOLATION-STAGE-2  all  --  anywhere             anywhere
DOCKER-ISOLATION-STAGE-2  all  --  anywhere             anywhere
DOCKER-ISOLATION-STAGE-2  all  --  anywhere             anywhere
DOCKER-ISOLATION-STAGE-2  all  --  anywhere             anywhere
DOCKER-ISOLATION-STAGE-2  all  --  anywhere             anywhere
RETURN     all  --  anywhere             anywhere

Chain DOCKER-ISOLATION-STAGE-2 (14 references)
target     prot opt source               destination
DROP       all  --  anywhere             anywhere
DROP       all  --  anywhere             anywhere
DROP       all  --  anywhere             anywhere
DROP       all  --  anywhere             anywhere
DROP       all  --  anywhere             anywhere
DROP       all  --  anywhere             anywhere
DROP       all  --  anywhere             anywhere
DROP       all  --  anywhere             anywhere
DROP       all  --  anywhere             anywhere
DROP       all  --  anywhere             anywhere
DROP       all  --  anywhere             anywhere
DROP       all  --  anywhere             anywhere
DROP       all  --  anywhere             anywhere
DROP       all  --  anywhere             anywhere
RETURN     all  --  anywhere             anywhere

Chain DOCKER-USER (1 references)
target     prot opt source               destination
f2b-bad-auth  tcp  --  anywhere             anywhere             multiport dports tcpmux:1024
RETURN     all  --  anywhere             anywhere

Chain f2b-bad-auth (1 references)
target     prot opt source               destination
DROP       all  --  120.hosted-by.bthoster.com  anywhere
DROP       all  --  80.94.95.181         anywhere
RETURN     all  --  anywhere             anywhere

Chain f2b-sshd (1 references)
target     prot opt source               destination
REJECT     all  --  154.221.30.14        anywhere             reject-with icmp-port-unreachable
REJECT     all  --  211.253.31.5         anywhere             reject-with icmp-port-unreachable
REJECT     all  --  139.95.8.160         anywhere             reject-with icmp-port-unreachable
RETURN     all  --  anywhere             anywhere
```
I have 2 DROP rules on bthoster.com addresses 3 REJECT rules on fail2ban sshd.
But I don't understand why it would block the access to the letsencrypt files...
